<?xml version="1.0" encoding="UTF-8"?>
<objectstore xmlns="http://ase4j.googlecode.com/schema"
	xmlns:xsi="http://www.w3.org/2001/XMLSchema-instance"
	xsi:schemaLocation="http://ase4j.googlecode.com/schema ../../../main/resources/objectstore.xsd">

	<!-- Object mapping for FileObjectStoreImplTest -->
	<store id="test" mode="dynamic">
		<class name="dynamic.test.TestData">
			<id name="url" type="java.lang.String" >
				<index type="trie">
					<parameter key="dictionary" value="URL" />
				</index>
			</id>

			<property name="id" type="java.lang.Integer" />
			<property name="added" type="java.util.Date" />

			<extension name="extensions" />
		</class>
	</store>
</objectstore>
